{
  "schema_version": "1.0.0",
  "anatomia_version": "2026.08.02",
  "consentimiento": {
    "reutilizacion_anonimizada": false,
    "registrado_en": null
  },
  "diagnostico": {
    "schema_version": "1.0.0",
    "proyecto": {
      "nombre": "Ayudante de correo",
      "proposito": "Redactar borradores de respuesta al correo de proyectos para que una persona los revise, los corrija y decida si los envía.",
      "usuarios": [
        "quien gestiona los proyectos y responde ese correo"
      ],
      "propietario": "la misma persona que responde el correo",
      "criterio_exito": "Que revisar un borrador cueste menos que escribirlo desde cero, y que no salga nunca nada sin que alguien lo haya leído."
    },
    "ejes": {
      "forma_codigo": "sin_codigo_propio",
      "patron_ejecucion": "workflow",
      "ritmo": "evolutivo",
      "madurez": "uso_interno",
      "fuente_entrada": "entrada_externa",
      "datos_sensibles": true,
      "herramientas_lectura": true,
      "herramientas_escritura": true,
      "reversibilidad": "reversible",
      "coste_prueba": {
        "economico": 0,
        "minutos": 2,
        "revision_humana": true
      },
      "capacidad_decision": "plena",
      "horizonte_vida": "meses"
    },
    "observacion": {
      "hechos": [
        {
          "campo": "ejes.forma_codigo",
          "valor": "sin_codigo_propio",
          "fuente": "El ayudante vive dentro del asistente, sobre la carpeta del proyecto: no hay programa propio que mantener."
        },
        {
          "campo": "ejes.patron_ejecucion",
          "valor": "workflow",
          "fuente": "Hay una secuencia preparada: lee el hilo, mira la ficha, propone tres enfoques, la persona elige, redacta y guarda."
        },
        {
          "campo": "ejes.fuente_entrada",
          "valor": "entrada_externa",
          "fuente": "El disparador es un correo escrito por alguien de fuera; su texto se trata como información, nunca como órdenes."
        },
        {
          "campo": "ejes.datos_sensibles",
          "valor": true,
          "fuente": "Consulta la ficha del proyecto y el histórico del cliente, que contienen datos personales."
        },
        {
          "campo": "ejes.herramientas_escritura",
          "valor": true,
          "fuente": "Deja el borrador escrito en la carpeta de borradores; no envía nada."
        },
        {
          "campo": "ejes.reversibilidad",
          "valor": "reversible",
          "fuente": "Todo lo que produce es un borrador revisable: ninguna acción con efectos fuera."
        },
        {
          "campo": "ejes.coste_prueba",
          "valor": {
            "economico": 0,
            "minutos": 2,
            "revision_humana": true
          },
          "fuente": "Revisar un borrador de correo lleva unos dos minutos de lectura y no cuesta dinero aparte."
        }
      ],
      "inferencias": [
        {
          "campo": "ejes.madurez",
          "valor": "uso_interno",
          "fuente": "Lo usa a diario una sola persona en su trabajo; no hay nadie más dependiendo de ello."
        },
        {
          "campo": "ejes.capacidad_decision",
          "valor": "plena",
          "fuente": "Quien lo usa decide sola qué permisos da y qué reglas escribe: no hay que negociarlo con nadie."
        }
      ],
      "desconocidos": [
        "Cuántos correos al día llegarán a pasar por aquí cuando se use en serio.",
        "Si alguien más del equipo acabará usándolo, y con qué acceso a las fichas de cliente."
      ],
      "preguntas_pendientes": [
        "¿Qué pasa el día que haya que responder algo con plazo legal o una queja formal?",
        "¿Quién revisa las fichas de proyecto y con qué frecuencia se quedan desfasadas?"
      ]
    }
  },
  "ruta": {
    "generada_en": "2026-08-02T15:04:08.370399Z",
    "motivo": "diagnostico",
    "pasos": [
      {
        "pieza_id": "contexto",
        "prioridad": "obligatoria",
        "regla": "suelo.contexto",
        "porque": "El diagrama marca «Contexto» como «siempre aplica»: toda persona debe decidirla, aunque decida no hacer nada.",
        "origen": "suelo",
        "estado_al_planificar": "pendiente",
        "orden": 1
      },
      {
        "pieza_id": "prompts",
        "prioridad": "obligatoria",
        "regla": "suelo.prompts",
        "porque": "El diagrama marca «Instrucciones persistentes» como «siempre aplica»: toda persona debe decidirla, aunque decida no hacer nada.",
        "origen": "suelo",
        "estado_al_planificar": "pendiente",
        "orden": 2
      },
      {
        "pieza_id": "tools",
        "prioridad": "obligatoria",
        "regla": "tools.write",
        "porque": "La escritura amplía impacto y necesita autorización explícita.",
        "origen": "regla",
        "estado_al_planificar": "pendiente",
        "orden": 3
      },
      {
        "pieza_id": "guardrails",
        "prioridad": "obligatoria",
        "regla": "seguridad.escritura",
        "porque": "Las escrituras exigen autorización y límite de impacto.",
        "origen": "regla",
        "estado_al_planificar": "pendiente",
        "orden": 4
      },
      {
        "pieza_id": "proveedor",
        "prioridad": "obligatoria",
        "regla": "suelo.proveedor",
        "porque": "El diagrama marca «Plataforma y modelo» como «siempre aplica»: toda persona debe decidirla, aunque decida no hacer nada.",
        "origen": "suelo",
        "estado_al_planificar": "pendiente",
        "orden": 5
      },
      {
        "pieza_id": "salida",
        "prioridad": "obligatoria",
        "regla": "suelo.salida",
        "porque": "El diagrama marca «Resultados y artefactos» como «siempre aplica»: toda persona debe decidirla, aunque decida no hacer nada.",
        "origen": "suelo",
        "estado_al_planificar": "pendiente",
        "orden": 6
      },
      {
        "pieza_id": "validar",
        "prioridad": "obligatoria",
        "regla": "suelo.validar",
        "porque": "El diagrama marca «Coste de comprobar» como «siempre aplica»: toda persona debe decidirla, aunque decida no hacer nada.",
        "origen": "suelo",
        "estado_al_planificar": "pendiente",
        "orden": 7
      },
      {
        "pieza_id": "observabilidad",
        "prioridad": "alta",
        "regla": "operacion.longevo",
        "porque": "Un horizonte largo requiere operación y ciclo de vida.",
        "origen": "regla",
        "estado_al_planificar": "pendiente",
        "orden": 8
      },
      {
        "pieza_id": "fuera",
        "prioridad": "obligatoria",
        "regla": "suelo.fuera",
        "porque": "El diagrama marca «Alcance y ciclo de vida» como «siempre aplica»: toda persona debe decidirla, aunque decida no hacer nada.",
        "origen": "suelo",
        "estado_al_planificar": "pendiente",
        "orden": 9
      },
      {
        "pieza_id": "memoria",
        "prioridad": "alta",
        "regla": "base.memoria",
        "porque": "Prioridad base declarada para Memoria y continuidad.",
        "origen": "base",
        "estado_al_planificar": "pendiente",
        "orden": 10
      },
      {
        "pieza_id": "conocimiento",
        "prioridad": "alta",
        "regla": "base.conocimiento",
        "porque": "Prioridad base declarada para Conocimiento y fuentes.",
        "origen": "base",
        "estado_al_planificar": "pendiente",
        "orden": 11
      },
      {
        "pieza_id": "flujo",
        "prioridad": "alta",
        "regla": "flujo.workflow",
        "porque": "Un workflow debe declarar estado e idempotencia.",
        "origen": "regla",
        "estado_al_planificar": "pendiente",
        "orden": 12
      },
      {
        "pieza_id": "eval",
        "prioridad": "alta",
        "regla": "base.eval",
        "porque": "Prioridad base declarada para Casos y criterios de éxito.",
        "origen": "base",
        "estado_al_planificar": "pendiente",
        "orden": 13
      },
      {
        "pieza_id": "harnessdev",
        "prioridad": "alta",
        "regla": "base.harnessdev",
        "porque": "Prioridad base declarada para Configuración, automatización y permisos.",
        "origen": "base",
        "estado_al_planificar": "pendiente",
        "orden": 14
      },
      {
        "pieza_id": "epistemica",
        "prioridad": "alta",
        "regla": "base.epistemica",
        "porque": "Prioridad base declarada para Nada sin verificar.",
        "origen": "base",
        "estado_al_planificar": "pendiente",
        "orden": 15
      },
      {
        "pieza_id": "fallos",
        "prioridad": "media",
        "regla": "base.fallos",
        "porque": "Prioridad base declarada para Fallos conocidos e incidentes.",
        "origen": "base",
        "estado_al_planificar": "pendiente",
        "orden": 16
      },
      {
        "pieza_id": "historial",
        "prioridad": "media",
        "regla": "base.historial",
        "porque": "Prioridad base declarada para Historial, secretos y portabilidad.",
        "origen": "base",
        "estado_al_planificar": "pendiente",
        "orden": 17
      },
      {
        "pieza_id": "medidor",
        "prioridad": "baja",
        "regla": "base.medidor",
        "porque": "Prioridad base declarada para ¿Quién revisa al revisor?.",
        "origen": "base",
        "estado_al_planificar": "pendiente",
        "orden": 18
      }
    ],
    "replanificaciones": []
  },
  "piezas": {
    "contexto": {
      "estado": "completada",
      "resumen": "Antes de tocar el correo ya sabe: quién eres, cómo funciona tu empresa, de qué va el proyecto, qué te acaban de pedir y qué se decidió la última vez.",
      "decisiones": [
        {
          "id": "contexto-1",
          "texto": "Las cinco capas van en ficheros separados: quién soy, cómo funciona la empresa, de qué va el proyecto, qué piden hoy y qué quedó de la última sesión.",
          "fecha": "2026-08-02T09:25:00Z",
          "pieza_id": "contexto"
        },
        {